{"all_bindings_match":true,"all_current_evidence_paths_exist":true,"boundaries":{"confirmatory_evidence_read":false,"independent_review_performed":false,"network_used":false,"scientific_claims_authorized":false},"classification":"same_worktree_structural_validation_not_independent_review","control_count":10,"current_evidence_path_count":63,"decision":"NO-GO","errors":[],"ledger_sha256":"d6cf97312ad656d092340ba7fee7fc767df1b8b3ebc0172cc09df3a93ec56a09","open_requirement_count":17,"registration_blocker_ids":["RG-001","RG-002","RG-004","RG-005","RG-006","RG-009","RG-010","RG-011","RG-013","RG-014"],"schema_sha256":"7462ffe4c88a208b9bb80afde8b4ab546151db6ac798e280b519ed626c1e7ffd","schema_version":"amy.pre-r0-closure-ledger-validation.v1","valid":true,"validator_sha256":"d9dabf90a74a26ccaf6c0dab3604ac802fb047461e60b6057f87fcdc5fbc1316"}